002:021:002:DESCRIPTOR         1648777874.851678
 06 01 FF 09 00 A1 01 09 01 A1 02 85 01 09 02 15
 00 25 01 75 01 95 48 81 02 09 06 15 00 26 E7 03
 75 10 95 08 81 02 09 09 15 00 26 FF 03 75 10 95
 02 81 02 09 03 15 00 25 0F 75 04 95 02 81 02 09
 0C 15 00 26 FF 00 75 08 95 01 81 02 C0 09 01 A1
 02 85 02 09 08 15 00 26 FF 07 75 10 95 02 81 02
 09 44 15 00 27 FF FF 00 00 75 10 95 03 81 02 C0
 09 01 A1 02 85 0F 09 A2 15 00 26 FF 00 75 08 95
 01 81 02 C0 09 40 A1 02 85 40 09 41 15 00 27 FF
 FF 00 00 75 10 95 0F 81 02 C0 09 80 A1 02 85 80
 09 81 15 00 25 7F 75 08 95 45 91 02 C0 09 80 A1
 02 85 81 09 81 15 00 25 7F 75 08 95 3D 91 02 C0
 09 A0 A1 02 85 A0 09 A2 15 00 26 FF 00 75 08 95
 01 91 02 09 A2 15 00 26 FF 00 75 08 95 01 91 02
 C0 09 A0 A1 02 85 A1 09 A2 15 00 26 FF 00 75 08
 95 60 91 02 09 A2 15 00 26 FF 00 75 08 95 60 91
 02 09 A2 15 00 25 1F 75 08 95 08 91 02 09 A2 15
 00 27 FF FF 00 00 75 10 95 01 91 02 09 A2 15 00
 26 FF 00 75 08 95 01 91 02 C0 09 A0 A1 02 85 A2
 09 A2 15 00 26 FF 00 75 08 95 0C 91 02 09 A2 15
 00 26 FF 00 75 08 95 0C 91 02 09 A2 15 00 26 FF
 00 75 08 95 14 91 02 C0 09 A0 A1 02 85 A3 09 A2
 15 00 26 FF 00 75 08 95 0C 91 02 09 A2 15 00 26
 FF 00 75 08 95 0C 91 02 09 A2 15 00 26 FF 00 75
 08 95 0C 91 02 09 A2 15 00 26 FF 00 75 08 95 0C
 91 02 09 A2 15 00 26 FF 00 75 08 95 0C 91 02 09
 A2 15 00 26 FF 00 75 08 95 0C 91 02 C0 09 A0 A1
 02 85 A4 09 A2 15 00 26 FF 00 75 08 95 80 91 02
 C0 09 A0 A1 02 85 AA 09 A2 15 00 27 FF FF 00 00
 75 10 95 19 81 02 C0 09 A0 A1 02 85 AF 09 A2 15
 00 26 FF 00 75 08 95 01 91 02 09 A2 15 00 26 FF
 00 75 08 95 01 91 02 C0 09 D0 A1 02 85 D0 09 D1
 15 00 27 FF FF 00 00 75 10 95 02 B1 02 09 D1 15
 00 26 FF 00 75 08 95 01 B1 02 09 E7 15 00 25 64
 75 08 95 01 B1 02 09 81 15 00 25 7F 75 08 95 01
 B1 02 09 D1 15 00 26 FF 00 75 08 95 01 B1 02 09
 E6 15 00 25 64 75 08 95 06 B1 02 09 D1 15 00 26
 FF 00 75 08 95 02 B1 02 09 D1 15 00 26 FF 00 75
 08 95 10 B1 02 C0 09 D8 A1 02 85 D8 09 D1 15 00
 27 FF FF 00 00 75 10 95 02 B1 03 09 D1 15 00 27
 FF FF 00 00 75 10 95 02 B1 03 09 D1 15 00 27 FF
 FF 00 00 75 10 95 04 B1 03 09 D1 15 00 26 FF 00
 75 08 95 01 B1 03 09 D1 15 00 26 FF 00 75 08 95
 0F B1 03 C0 09 D8 A1 02 85 D9 09 D1 15 00 26 FF
 00 75 08 95 20 B1 03 C0 09 F0 A1 02 85 F0 09 06
 15 00 26 FF 00 75 08 95 08 B1 02 09 09 15 00 26
 FF 00 75 08 95 02 B1 02 09 08 15 00 26 FF 00 75
 08 95 02 B1 02 C0 09 F0 A1 02 85 F1 09 81 15 00
 25 7F 75 08 95 D0 B1 02 C0 09 F0 A1 02 85 F3 09
 81 15 00 25 7F 75 08 95 01 91 02 C0 09 F0 A1 02
 85 F4 09 F4 15 00 26 FF 00 75 08 95 01 91 02 09
 F5 15 00 26 FF 00 75 08 95 1F 91 02 C0 09 E0 A1
 02 85 F8 09 E1 15 00 27 FF FF 00 00 75 10 95 01
 B1 03 09 E2 15 00 27 FF FF 00 00 75 10 95 01 B1
 03 09 E3 15 00 26 FF 00 75 08 95 01 B1 03 09 E4
 15 00 26 FF 00 75 08 95 01 B1 03 09 E5 15 00 26
 FF 00 75 08 95 01 B1 03 09 E7 15 00 25 64 75 08
 95 01 B1 02 09 E6 15 00 25 64 75 08 95 01 B1 02
 09 E8 15 00 25 01 75 08 95 01 B1 02 C0 09 E0 A1
 02 85 F9 09 E1 15 00 27 FF FF 00 00 75 10 95 01
 B1 03 09 E2 15 00 27 FF FF 00 00 75 10 95 01 B1
 03 09 E3 15 00 26 FF 00 75 08 95 01 B1 03 09 E4
 15 00 26 FF 00 75 08 95 01 B1 03 09 E5 15 00 26
 FF 00 75 08 95 01 B1 03 09 E7 15 00 25 64 75 08
 95 01 B1 02 09 E6 15 00 25 64 75 08 95 01 B1 02
 09 E8 15 00 25 01 75 08 95 01 B1 02 C0 C0

002:021:002:STREAM             1648777874.853538
 AA 7F 00 7F 00 00 00 00 00 00 00 00 00 00 00 00
 00 0F 00 00 00 00 00 1D 00 07 00 00 00 00 00 00
 00 00 00 00 00 01 00 60 50 00 00 00 00 C0 60 00
 00 00 00

002:021:002:STREAM             1648777874.853779
 AA 7F 00 7F 00 00 00 00 00 00 00 00 00 00 00 00
 00 0F 00 00 00 00 00 1D 00 07 00 00 00 00 00 00
 00 00 00 00 00 00 00 60 50 00 00 00 00 C0 60 00
 00 00 00

002:021:002:STREAM             1648777876.958797
 01 00 20 00 00 00 00 00 00 00 85 00 34 02 3D 03
 E4 00 38 00 6C 02 EF 01 6E 01 00 00 00 00 0E 24

002:021:002:STREAM             1648777877.113783
 01 00 00 00 00 00 00 00 00 00 85 00 34 02 3D 03
 E4 00 38 00 6C 02 EF 01 6E 01 00 00 00 00 0E 24

002:021:002:STREAM             1648777877.800791
 01 00 00 08 00 00 00 00 00 00 85 00 34 02 3D 03
 E4 00 38 00 6C 02 EF 01 6E 01 00 00 00 00 0E 24

002:021:002:STREAM             1648777877.960781
 01 00 00 00 00 00 00 00 00 00 85 00 34 02 3D 03
 E4 00 38 00 6C 02 EF 01 6E 01 00 00 00 00 0E 24

002:021:002:STREAM             1648777878.774780
 01 00 00 04 00 00 00 00 00 00 85 00 34 02 3D 03
 E4 00 38 00 6C 02 EF 01 6E 01 00 00 00 00 0E 24

002:021:002:STREAM             1648777878.929775
 01 00 00 00 00 00 00 00 00 00 85 00 34 02 3D 03
 E4 00 38 00 6C 02 EF 01 6E 01 00 00 00 00 0E 24

002:021:002:STREAM             1648777879.859774
 01 00 10 00 00 00 00 00 00 00 85 00 34 02 3D 03
 E4 00 38 00 6C 02 EF 01 6E 01 00 00 00 00 0E 24

002:021:002:STREAM             1648777880.005756
 01 00 00 00 00 00 00 00 00 00 85 00 34 02 3D 03
 E4 00 38 00 6C 02 EF 01 6E 01 00 00 00 00 0E 24

002:021:002:STREAM             1648777880.870768
 01 00 00 02 00 00 00 00 00 00 85 00 34 02 3D 03
 E4 00 38 00 6C 02 EF 01 6E 01 00 00 00 00 0E 24

002:021:002:STREAM             1648777881.043759
 01 00 00 00 00 00 00 00 00 00 85 00 34 02 3D 03
 E4 00 38 00 6C 02 EF 01 6E 01 00 00 00 00 0E 24

002:021:002:STREAM             1648777882.162758
 01 00 00 01 00 00 00 00 00 00 85 00 34 02 3D 03
 E4 00 38 00 6C 02 EF 01 6E 01 00 00 00 00 0E 24

002:021:002:STREAM             1648777882.326752
 01 00 00 00 00 00 00 00 00 00 85 00 34 02 3D 03
 E4 00 38 00 6C 02 EF 01 6E 01 00 00 00 00 0E 24
